{
  "outcomes": [
    {
      "id": "O1",
      "text": "区分统计发布中的隐私泄露与原始记录的数据泄密"
    },
    {
      "id": "O2",
      "text": "解释差分隐私适用的发布环节及隐私与效用取舍"
    },
    {
      "id": "O3",
      "text": "为虚构学习分析方案提出数据最小化、访问和发布核查步骤"
    }
  ],
  "facts": [
    {
      "source_id": "DP-MIN",
      "quote": "教学分析只收集完成既定教学目标所需的数据；能够使用汇总数据时，不收集个人明细。"
    },
    {
      "source_id": "DP-LEAK",
      "quote": "即使不公开姓名，小样本分组或多次重叠查询也可能让人从统计结果推断出个人信息；发布前应检查可识别风险。"
    },
    {
      "source_id": "DP-BREACH",
      "quote": "原始学习记录若因共享配置错误、账号被盗或越权导出而流向未授权方，属于数据泄密风险；应限制访问、核查导出并按既定流程处理事件。"
    },
    {
      "source_id": "DP-DP",
      "quote": "差分隐私通过随机化机制限制单个人的数据对发布统计结果的影响；通常较小的 ε 意味着更强的保护、也可能带来更大误差，多次发布会累计隐私损失；它不能保护已泄出的原始记录。"
    }
  ],
  "activity": {
    "outcome_ids": [
      "O1",
      "O2",
      "O3"
    ],
    "instructions": "某虚构课程拟收集个人答题记录，并向外发布小班分组统计。请区分可推断的隐私泄露与原始记录被导出的数据泄密，说明差分隐私可用于哪个环节、有什么误差与累计发布代价，并提出访问和发布前核查。"
  },
  "reflection": [
    "差分隐私能否补救原始记录被越权导出？为什么？",
    "统计发布的隐私参数与误差应由谁核查，哪些信息在资料中尚未给出？"
  ]
}
